{
  "schemaVersion": "s1.4x-toolchain-provenance-v1",
  "stackPolicy": "GHCup-managed exact-version installation",
  "stackInstallCommand": "ghcup install stack 3.11.1",
  "ghcupToolId": "GHCUP_0_2_6_2_LINUX_X86_64",
  "ghcupVersion": "0.2.6.2",
  "ghcupReleaseUri": "https://github.com/haskell/ghcup-hs/releases/tag/v0.2.6.2",
  "ghcupAssetUri": "https://github.com/haskell/ghcup-hs/releases/download/v0.2.6.2/x86_64-linux-ghcup-0.2.6.2",
  "ghcupAssetSha256": "9ed5da5449b48043a0d17e767c05d2ef585e25a639bb934329496c6d2fad9cf8",
  "ghcupMetadataCommit": "0341867f2d419567cf42ea6931e031b00ab3a922",
  "ghcupMetadataUri": "https://github.com/haskell/ghcup-metadata/commit/0341867f2d419567cf42ea6931e031b00ab3a922",
  "ghcupMetadataRawUri": "https://raw.githubusercontent.com/haskell/ghcup-metadata/0341867f2d419567cf42ea6931e031b00ab3a922/ghcup-0.1.0.yaml",
  "ghcupMetadataRawSha256": "49c8a036ce399587205a11ac24e73465cadc5f3232e9418a9d87f4b7f746c4ec",
  "stackDistributionChannel": "ghcup-managed",
  "stackArchiveUri": "https://downloads.haskell.org/~ghcup/unofficial-bindists/stack/3.11.1/stack-3.11.1-linux-x86_64.tar.gz",
  "stackArchiveSha256": "ca3cc5e89d87d1b85594a866de4062671d19ec039cd2401df70d4ccff03ffed9",
  "stackBinPathId": "GHCUP_STACK_3_11_1",
  "stackBinResolver": "ghcup whereis stack 3.11.1",
  "stackBinSha256": "923dbd137756652c67b376e2447c655b87fcc373f4d104b5073bca913471ecbe",
  "stackNumericVersion": "3.11.1",
  "upstreamStandaloneAssetUri": "https://github.com/commercialhaskell/stack/releases/download/v3.11.1/stack-3.11.1-linux-x86_64-bin",
  "upstreamStandaloneAssetSha256": "67c66e918801c41ae4d286b1c91f9124f691c1c7d56071b53889cf4a5c667550",
  "upstreamStandaloneAssetRole": "comparison-only-not-installed-provenance",
  "verifiedAt": "2026-07-18T05:52:12Z",
  "gate0MetadataEntryEvidence": {
    "sourceSha256": "d9598208e4b50d830c68cec95d645714094b81fccd29d74bc1c08f41a4581268",
    "serialization": "canonical-json-utf8",
    "payload": {
      "metadataCommit": "0341867f2d419567cf42ea6931e031b00ab3a922",
      "metadataRawSha256": "49c8a036ce399587205a11ac24e73465cadc5f3232e9418a9d87f4b7f746c4ec",
      "metadataRawUri": "https://raw.githubusercontent.com/haskell/ghcup-metadata/0341867f2d419567cf42ea6931e031b00ab3a922/ghcup-0.1.0.yaml",
      "sourceSha256": "d9598208e4b50d830c68cec95d645714094b81fccd29d74bc1c08f41a4581268",
      "stackArchiveSha256": "ca3cc5e89d87d1b85594a866de4062671d19ec039cd2401df70d4ccff03ffed9",
      "stackArchiveUri": "https://downloads.haskell.org/~ghcup/unofficial-bindists/stack/3.11.1/stack-3.11.1-linux-x86_64.tar.gz",
      "verifiedAt": "2026-07-18T05:52:12Z",
      "sourceCommit": "0d1a73103999f8a0a50cb131446259f1c32274c4"
    },
    "digestSha256": "68158902c6d3617b803421c0b7a760a5b02a0caf9db5e1becd6637e1b2eb78e0",
    "sourceCommit": "0d1a73103999f8a0a50cb131446259f1c32274c4"
  }
}
